term,definition
iteration,"Iteration refers to the number of times an algorithm’s parameters are updated while training a model on a dataset. For example, each iteration of training a neural network takes certain number of training data and updates the weights by using gradient descent or some other weight update rule."
julia,"Julia is a high-level, high-performance dynamic programming language for numerical computing. Some important features of Julia are:"
keras,"Keras is a simple, high-level neural network library, written in Python. It is capable of running on top of Tensorflow and Theano. This is done to make design and experiments with Neural Networks easier."
labeled_data,"A labeled dataset has a meaningful “label”, “class” or “tag” associated with each of its records or rows. For example, labels for a dataset of a set of images might be whether an image contains a cat or a dog."
line_chart,"Line charts are used to display information as series of points connected by straight line segment. These charts are used to communicate information visually, such as to show an increase or decrease in the trend in data over intervals of time."
log_loss,"Log Loss or Logistic loss is one of the evaluation metrics used to find how good the model is. Lower the log loss, better is the model. Log loss is the logarithm of the product of all probabilities."
logistic_regression,"In simple words, it predicts the probability of occurrence of an event by fitting data to a"
long_short_term_memory_(lstm),"Long short-term memory (LSTM) units (or blocks) are a building unit for layers of a recurrent neural network (RNN). A common LSTM unit is composed of a cell, an input gate, an output gate and a forget gate. The cell is responsible for “remembering” values over arbitrary time intervals, hence the word “memory” in LSTM. Each of the three gates can be thought of as a “conventional” artificial neuron, as in a multi-layer neural network, that is, they compute an activation (using an activation function) of a weighted sum. Applications of LSTM include:"
mahout,"Mahout is an open source project from Apache that is used for creating scalable machine learning algorithms. It implements popular machine learning techniques such as recommendation, classification, clustering."
mapreduce,"Hadoop MapReduce is a software framework for easily writing applications which process vast amounts of data (multi-terabyte data-sets) in-parallel on large clusters (thousands of nodes) of commodity hardware in a reliable, fault-tolerant manner."
market_basket_analysis,Market Basket Analysis (also called as MBA) is a widely used technique among the Marketers to identify the best possible combinatory of the products or services which are frequently bought by the customers. This is also called product association analysis.Association analysis mostly done based on an algorithm named “Apriori Algorithm”. The Outcome of this analysis is called association rules. Marketers use these rules to strategize their recommendations.
market_mix_modeling,Market Mix Modeling is an analytical approach that uses historical information like point of sales to quantify the impact of some of the components on sales.
maximum_likelihood_estimation,It is a method for finding the values of parameters which make the likelihood maximum. The resulting values are called maximum likelihood estimates (MLE).
mean,"For a dataset, mean is said to be the average value of all the numbers. It can sometimes be used as a representation of the whole data."
median,"Median of a set of numbers is usually the middle value. When the total numbers in the set are even, the median will be the average of the two middle values. Median is used to measure the central tendency."
mis,"A management information system (MIS) is a computer system consisting of hardware and software that serves as the backbone of an organization’s operations. An MIS gathers data from multiple online systems, analyzes the information, and reports data to aid in management decision-making."
ml_as_a_service_(mlaas),"Machine learning as a service (MLaaS) is an array of services that provide machine learning tools as part of cloud computing services. This can include tools for data visualization, facial recognition, natural language processing, image recognition, predictive analytics, and deep learning. Some of the top ML-as-a-service providers are:"
mode,"Mode is the most frequent value occuring in the population. It is a metric to measure the central tendency, i.e. a way of expressing, in a (usually) single number, important information about a random variable or a population."
model_selection,Model selection is the task of selecting a statistical model from a set of known models. Various methods that can be used for choosing the model are:
monte_carlo_simluation,The idea behind Monte Carlo Simulation is to use random samples of parameters or inputs to explore the behavior of a complex process. Monte Carlo simulations sample from a probability distribution for each variable to produce hundreds or thousands of possible outcomes. The results are analyzed to get probabilities of different outcomes occurring.
multi_class_classification,Problems which have more than one class in the target variable are called multi-class Classification problems.
multivariate_analysis,Multivariate analysis is a process of comparing and analyzing the dependency of multiple variables over each other.
multivariate_regression,"Multivariate, as the word suggests, refers to ‘multiple dependent variables’. A regression model designed to deal with multiple dependent variables is called a multivariate regression model."
naive_bayes,"It is a classification technique based on Bayes’ theorem with an assumption of independence between predictors. In simple terms, a Naive Bayes classifier assumes that the presence of a particular feature in a class is unrelated to the presence of any other feature. For example, a fruit may be considered to be an apple if it is red, round and about 3 inches in diameter. Even if these features depend on each other or upon the existence of the other features, a naive Bayes classifier would consider all of these properties to independently contribute to the probability that this fruit is an apple."
natural_language_processing,"In simple words, Natural Language Processing is a field which aims to make computer systems understand human speech. NLP is comprised of techniques to process, structure, categorize raw text and extract information."
nosql,"NoSQL means Not only SQL. A NoSQL database provides a mechanism for storage and retrieval of data that is modeled in means other than the tabular relations used in relational databases. It can accommodate a wide variety of data models, including key-value, document, columnar and graph formats."
nominal_variable,Nominal variables are
normalization,Normalization is the process of rescaling your data so that they have the same scale. Normalization is used when the attributes in our data have varying scales.
numpy,NumPy is the fundamental package for scientific computing with Python. It contains among other things:
one_shot_learning,It is a machine learning approach where the model is trained on a single example. One-shot Learning is generally used for object classification. This is performed to design effective classifiers from a single training example.
oozie,Apache Oozie is the tool in which all sort of programs can be pipelined in a desired order to work in Hadoop’s distributed environment. Oozie also provides a mechanism to run the job at a given schedule.
ordinal_variable,Ordinal variables are those variables which have discrete values but has some order involved. Refer
outlier,Outlier is an observation that appears far away and diverges from an overall pattern in a sample.
overfitting,A model is said to overfit when it performs well on the train dataset but fails on the test set. This happens when the model is too sensitive and captures random patterns which are present only in the training dataset. There are two methods to overcome overfitting:
pandas,"Pandas is an open source, high-performance, easy-to-use data structure and data analysis library for the Python programming language. Some of the highlights of Pandas are:"
parameters,"Parameters are a set of measurable factors that define a system. For machine learning models, model parameters are internal variables whose values can be determined from the data."
pattern_recognition,Pattern recognition is a branch of machine learning that focuses on the recognition of patterns and regularities in data. Classification is an example of pattern recognition wherein each input value is assigned one of a given set of classes.
pie_chart,"A pie chart is a circular statistical graphic which is divided into slices to illustrate numerical proportion. The arc length of each slice, is proportional to the quantity it represents. Let us understand it with an example:"
pig,"Pig is a high level scripting language that is used with Apache Hadoop. Pig enables data workers to write complex data transformations without knowing Java. Pig is complete, so one can do all required data manipulations in Apache Hadoop with Pig. Through the User Defined Functions(UDF) facility in Pig, Pig can invoke code in many languages like JRuby, Jython and Java."
predictor_variable,Predictor variable is used to make a prediction for dependent variables.
principal_component_analysis_(pca),"Principal component analysis (PCA) is an approach to factor analysis that considers the total variance in the data, and transforms the original variables into a smaller set of linear combinations. PCA is sensitive to outliers; they should be removed."
p_value,"P-value is the value of probability of getting a result equal to or greater than the observed value, when the null hypothesis is true."
python,"Python is an open source programming language, widely used for various applications, such as general purpose programming, data science and machine learning. Usually preferred by beginners in these fields because of the following major advantages:"
pytorch,"PyTorch is an open source machine learning library for python, based on Torch. It is built to provide flexibility as a deep learning development platform. Here are a few reasons for which PyTorch is extensively used :"
recommendation_engine,"Generally people tend to buy products recommended to them by their friends or the people they trust. Nowadays in the digital age, any online shop you visit utilizes some sort of recommendation engine. Recommendation engines basically are data filtering tools that make use of algorithms and data to recommend the most relevant items to a particular user. If we can recommend items to a customer based on their needs and interests, it will create a positive effect on the user experience and they will visit more frequently. There are few types of recommendation engines:"
regression_spline,"Regression Splines is a non-linear approach that uses a combination of linear/polynomial functions to fit the data. In this technique, instead of building one model for the entire dataset, it is divided into multiple bins and a separate model is built on each bin."
regularization,"Regularization is a technique used to solve the overfitting problem in statistical models. In machine learning, regularization penalizes the coefficients such that the model generalize better. We have different types of regression techniques which uses regularization such as Ridge regression and lasso regression."
residual,"Residual of a value is the difference between the observed value and the predicted value of the quantity of interest. Using the residual values, you can create residual plots which are useful for understanding the model."
response_variable,Response variable (or dependent variable) is that variable whose variation depends on other variables.
roc_auc,"Let’s first understand what is ROC (Receiver operating characteristic) curve. If we look at the confusion matrix, we observe that for a probabilistic model, we get different value for each metric."
root_mean_squared_error_(rmse),RMSE is a measure of the differences between values predicted by a model or an estimator and the values actually observed. It is the standard deviation of the residuals. Residuals are a measure of how far from the regression line data points are. The formula for RMSE is given by:
rotational_invariance,"In mathematics, a function defined on an inner product space is said to have rotational invariance if its value does not change when arbitrary rotations are applied to its argument."
scala,Scala is a general purpose language that combines concepts of object-oriented and functional programming languages. Here are some key features of Scala
smote,"It is a Synthetic Minority Over-Sampling Technique which is an approach to the construction of classifiers from imbalanced datasets is described. The idea behind this technique is that over-sampling the minority (abnormal) class and under-sampling the majority (normal) class can achieve better classifier performance (in ROC space) than only under-sampling the majority class. This is an over-sampling approach in which the minority class is over-sampled by creating “synthetic” examples rather than by over-sampling with replacement. To read further on SMOTE, refer"
spatial_temporal_reasoning,"Spatial-temporal reasoning is an area of artificial intelligence which draws from the fields of computer science, cognitive science, and cognitive psychology. Spatial-temporal reasoning is the ability to mentally move objects in space and time to solve multi-step problems. Three important things about Spatial-temporal reasoning are:"
standard_deviation,Standard deviation signifies how dispersed is the data. It is the square root of the variance of underlying data. Standard deviation is calculated for a population.
standardization,"Standardization (or Z-score normalization) is the process where the features are rescaled so that they’ll have the properties of a standard normal distribution with μ=0 and σ=1, where μ is the mean (average) and σ is the standard deviation from the mean. Standard scores (also called"
standard_error,"A standard error is the standard deviation of the sampling distribution of a statistic. The standard error is a statistical term that measures the accuracy of which a sample represents a population. In statistics, a sample mean deviates from the actual mean of a population this deviation is known as standard error."
statistics,"It is the study of the collection, analysis, interpretation, presentation, and organisation of data."
stochastic_gradient_descent,"Stochastic Gradient Descent is a type of gradient descent algorithm where we take a sample of data while computing the gradient. The update to the coefficients is performed for each training instance, rather than at the end of the batch of instances."
tensorflow,"TensorFlow, developed by the Google Brain team, is an open source software library. It is used for building machine learning models for range of tasks in data science, mainly used for machine learning applications such as building neural networks. TensorFlow can also be used for non- machine learning tasks that require numerical computation."
tokenization,Tokenization is the process of splitting a text string into units called tokens. The tokens may be words or a group of words. It is a crucial step in Natural Language Processing.
torch,"Torch is an open source machine learning library, based on the Lua programming language. It provides a wide range of algorithms for deep learning."
transfer_learning,Transfer learning refers to applying a pre-trained model on a new dataset. A pre-trained model is a model created by someone to solve a problem. This model can be applied to solve a similar problem with similar data.
true_negative,"These are the points which are actually false and we have predicted them false. For example, consider an example where we have to predict whether the loan will be approved or not. Y represents that loan will be approved, whereas N represents that loan will not be approved. So, here the True negative will be the number of classes which are actually N and we have predicted them N as well."
true_positive,"These are the points which are actually true and we have predicted them true. For example, consider an example where we have to predict whether the loan will be approved or not. Y represents that loan will be approved, whereas N represents that loan will not be approved. So, here the True positive will be the number of classes which are actually Y and we have predicted them Y as well."
type_i_error,"The decision to reject the null hypothesis could be incorrect, it is known as"
type_ii_error,"The decision to retain the null hypothesis could be incorrect, it is know as"
t_test,"T-test is used to compare two population by finding the difference of their population means. For more, refer"
underfitting,Underfitting occurs when a statistical model or machine learning algorithm cannot capture the underlying trend of the data. It refers to a model that can neither model on the training data nor generalize to new data. An underfit model is not a suitable model as it will have poor performance on the training data.
univariate_analysis,Univariate analysis is comparing and analyzing the dependency of a single predictor and a response variable
nan,"NaN stands for ‘not a number’. It is a numeric data type value representing an undefined or unrepresentable value. If the dataset has NaN values somewhere, it means that the data at that location is either missing or represented incorrectly."
z_test,"Z-test determines to what extent a data point is away from the mean of the data set, in standard deviation. For example:"
zookeeper,ZooKeeper is a software project of the Apache Software Foundation. It is an open source file application program interface (API) that allows distributed processes in large systems to synchronize with each other so that all clients making requests receive consistent data.
predictive_analytics,"Technology that learns from experience (data) to predict the outcome or behavior of individuals in order to drive better decisions. Predictive analytics is the use of machine learning for various commercial, industrial, and government applications. All applications of predictive analytics are applications of machine learning, and so the two terms are used somewhat interchangeably, depending on context. However, the reverse is not true: If you use machine learning to, for example, calculate the next best move playing checkers, or to solve certain engineering or signal processing problems, such as calculating the chances a high resolution photo has a traffic light within it, those uses of machine learning are rarely referred to as predictive analytics"
predictive_model,"A mechanism that predicts a behavior or outcome for an individual, such as click, buy, lie, or die. It takes characteristics of the individual as input (independent variables) and provides a predictive score as output, usually in the form of a probability. The higher the score, the more likely it is that the individual will exhibit the predicted behavior. Since it is generated by machine learning, we say that a predictive model is the thing that’s “learned”. Because of this, machine learning is also known as predictive modeling"
n_individual,"Within the definitions of predictive analytics and predictive model, individual is an intentionally broad term that can refer not only to individual people – such as customers, employees, voters, and healthcare patients – but also to other organizational elements, such as corporate clients, products, vehicles, buildings, manholes, transactions, social media posts, and much more. Whatever the domain, predictive analytics renders predictions over scalable numbers of individuals. That is, it operates at a lower level of granularity. This is what differentiates predictive analytics from forecasting"
training_data,"The data from which predictive modeling learns – that is, the data that machine learning software takes as input. It consists of a list (set) of [training] examples, aka training cases. For many business applications of machine learning, it is in the form of one row per example, each example corresponding to one individual"
labeled_data_training_data,"Training data  for which the correct answer is already known for each example, that is, for which the behavior or outcome being predicted is already labeled. This provides examples from which to learn, such as a list of customers, each one labeled as to whether or not they made a purchase. In some cases, labeling requires a manual effort, e.g., for determining whether an object such as a stop sign appears within a photograph or whether a certain healthcare condition is indicated within a medical image."
supervised_machine_learning_machine_learning,"that is guided by . The labels guide or “supervise” the learning process and also serve as the basis with which to evaluate a . Supervised machine learning is the most common form of machine learning and is the focus of this entire three-course series, so we will generally refer to it simply as machine learning."
unsupervised_machine_learning,"Methods that attempt to derive insights from unlabeled data. One common method is clustering, which groups examples together by some measure of similarity, trying to form groups that are as “cohesive” as possible. Since there are no correct answers – no labels – with which to assess the resulting groups, it’s generally a subjective choice as to how best to evaluate how good the results of learning are. This three-course series does not cover unsupervised learning (other than giving this definition and as a small part of a one-video case study on  within Course 3)."
forecasting,"Methods that make aggregate predictions on a macroscopic level that apply across . For example: How will the economy fare? Which presidential candidate will win more votes in Ohio? Forecasting estimates the overall total number of ice cream cones that will be purchased next month in Nebraska, while  tells you which individual Nebraskans are most likely to be seen with cone in hand."
data_science_/_big_data_/_analytics_/_data_mining,"Beyond “the clever use of data”, these subjective umbrella terms do not have agreed definitions. However, their various, competing definitions do generally include as a subtopic, as well as other forms of data analysis such as data visualization or, in some cases, just basic reporting. These terms do allude to a vital cultural movement led by thoughtful data wonks and other smart people doing creative things to make value of data. However, they don’t necessarily refer to any particular technology, method, or value proposition."
machine_learning_application,"A value proposition determined by two elements: 1) What’s predicted: the behavior or outcome to predict with a  for each individual, such as whether they’ll click, buy, lie, or die. And 2) What’s done about it: the operational decision to be driven for each individual by each corresponding prediction; that is, the action taken by the organization in response to or informed by each  output score, such as whether to contact, whether to approve for a credit card, or whether to investigate for fraud."
deployment,"The automation or support of operational decisions that is driven by the probabilistic scores output by a  – that is, the actual launch of the model. This requires the scores to be integrated into operations. For example, target a retention campaign to the top 5% of customers most likely to purchase if contacted."
decision_automation,The deployment of a  to drive a series of operational decisions automatically.
decision_support,"The deployment of a  to inform operational decisions made by a person. In their decision-making process, the person informally integrates or considers the model’s predictive scores in whatever ad hoc manner they see fit."
offline_deployment,"Scoring a batch job for which speed is not a great concern. For example, when selecting which customer to include for a direct marketing campaign, the computer can take more time, relatively speaking. Milliseconds are usually not a concern."
real_time_deployment,"Scoring as quickly as possible to inform an operational decision taking place in real time. For example, deciding which ad to show a customer at the moment a web page is loading means that the model must very quickly receive the customer’s as input and do its calculations so that the predictive score is then almost immediately available to the operational system."
the_prediction_effect,A little prediction goes a long way. Predicting better than guessing is very often more than sufficient to render mass scale operations more effective.
the_data_effect,"Data is always predictive. For all intents and purposes, virtually any given data set will reveal predictive insights. Leading UK consultant Tom Khabaza put it this way: “Projects never fail due to lack of patterns.” That is, other pitfalls may derail a machine learning project, but that generally won’t happen because of a lack of value in the data."
response_modeling,"For marketing, predictively modeling whether a customer will purchase if contacted in order to decide whether to include them for contact."
churn_modeling,"For marketing, predictively modeling whether a customer will leave (i.e., defect, cancel, attrite, or leave) in order to decide whether to extend a retention offer."
workforce_churn_modeling,"Predictively modeling whether an employee will leave (e.g., quit or be terminated) in order to to take measures to retain them or to plan accordingly."
